{
  "run_id": "00000000-0000-0000-0000-0000000000a1",
  "org_id": "00000000-0000-0000-0000-00000000002a",
  "status": "completed",
  "cost_micros": 70000,
  "baseline_micros": 180000,
  "saved_micros": 110000,
  "cost_usd": 0.07,
  "baseline_usd": 0.18,
  "saved_usd": 0.11,
  "signature_hex": "f946c8b348548822e717adc1749f6ac889d5a9ea6f065a3df01baf887814cb47c0149141b7581c68353239f1441b6c837570acbc42b69e468a3a219fb3e0b00d",
  "verifying_key_hex": "ea4a6c63e29c520abef5507b132ec5f9954776aebebe7b92421eea691446d22c",
  "canonical_version": "v1",
  "signed_at": "2026-07-15T00:00:00Z"
}
